start	end	text
1183940	1187280	And I want to leave you with a final lingering thought to ponder on your own.
1187600	1192740	If genuine human thought is, at its core, wordless and imageless, if it is fundamentally
1192740	1197760	about compressing vast amounts of contextual lived experience into a mere feeling of rightness
1197760	1204060	or wrongness, what happens to human evolution if we begin to systematically ignore those quiet
1204060	1205760	pre-linguistic gut feelings?
1206240	1206640	Wow.
1206800	1211820	What happens if we constantly favor perfectly articulated but entirely hollow machine-generated
1211820	1214620	words over our own messy epistemic friction?
1215100	1220300	Could our very capacity for deep, wordless thought actually atrophy over time if we stop
1220300	1220980	listening to it?
1221440	1223880	It all comes back to that screen and the icons.
1224220	1228900	If we spend all our time staring at the shiny graphical user interface, marveling at how
1228900	1231640	fluent it is, we might just forget how to write our own machine code.
1232120	1233900	Thank you so much for joining us on this deep dive.
1234140	1236260	Stay curious, trust your friction, and we'll catch you next time.
